,Reviews
146,"Your just recent update is disaster, you can't watch live video, please try and fix it immediately."
147,Its not working at all . A troublesome app. 14 hrs passed still company is not capable of fixing the problem.😡
148,it's not working properly .whenever I try to log in with my email and password it doesn't work.... ......
149,This was good back then without the updates.. now I can't open my acc.. please fix this. I'll fix my ratings.
150,There is no visible notification and please update it to a newer version it's kinda out dated. Other then this its a very good app. 👍🏻
151,"Absolute trash. Rarely loads, shows posts or news feed properly. If I could give it 0 stars, I would."
152,"This app is very nice , and very fast.It doesn't use much storage and works good on all network types"
153,Please make navigation bar color to adaptive or in white.White interface in app and black navigation bar don't look good at all.
154,My fb lite doesn't working anymore.suddenly when i open the app the only show is the loading screen and 3 days later i can't open the app..Can you fix the bug
155,Honestly speaking 📢am like super tired😴 of deleting it and download more than i can remember 💭coz when ever i opened it ⌛it just work within five minutes and start showing that i don't have data whilst my what's up is full of chat 😢so in short 💭my question here's 🙏what could really be the prob...Full Review
156,"Good app, but since today not working and I aslo reinstall the app tryed again but not working, this is so crazy 🤷🏻‍♂️"
157,Can't even write a comment after the recent update it doesn't show anything that i type on the comment bar. Fix this problem otherwise the app is good
158,"Fantastic, I live this Facebook, its working so easily,having fun with, great features, so fast...........................................................extraordinary app"
159,How I wish the app had gestures such as when viewing a photo in full screen mode and just swipe up to dismiss the photo.
160,It has been excellent good job.. please make it possible for users to be able to save media eg videos to their Galleries
161,Lite version is either taking too much time to load or not loading at all despite updating it regularly....😡
162,"Sir, I'm not able to login my fb id in fb lite. It shows continuous Loading... and it not finished ever."
163,Are appealing again and again to activate the account but no problem has been solved.
164,Fb lite need to do something about this app.... I have been having troubles creating a post update by the use of photos... This is after updating the so called app...its been a month now.. I need a response urgently.... Or i could have an alternative..
165,This app is good for everything bt nowadays this is not working properly and photo quality is very poor.
166,I give four star because is nice but I always searching na font size in setting I didn't find it I want my font size become small please can you came back the font size in settings because my font size is big please
167,Excellent But it's really good to connect to irrespective of the fact that many want cheap success.
168,"I like the site, it's really good not boring just that increase on the number of friends to have"
169,"The app takes time to show new messages or video. It's really poor for messaging and all. Although, it's has it's good times when it's comes to watching video since it's seems to do that perfectly but most of the time, it's takes forever to load and sometimes logs you out"
170,"The app is terrible...I can't open it.,,this is the response I get when I try opening it.""lite keeps stopping"""
171,"What the hell have you done to the Facebook lite messenger, it takes a long while to open ever since I last updated it!!"
172,I just love it this app is my second world I can contact my friends and family without using data and it's working perfectly fine 👌
173,No refresh any feed or any data...only one post are open..after updating also this problem had face...very poor service
174,Why I cannot adjust my font size? It's been a week the update is freaking bad. Please bring back the font size setting.
175,"facebook lite, what's going on? why i can't enter? it always says "" we're sorry"" please fix this, I've been using this app since a decade now."
176,This Facebook application is one the most convenient communication platform where most the people around world are using at the moment.
177,Developers please fix the issue it did not load anymore.. It is only loading and loading and so on still loading...
178,"Where did you put the font size settings? Wth. My FB Lite app crashed then after I opened it again, the font size got bigger. BRING BACK THE SMALL FONT SIZE BECAUSE FB LITE WITH BIGGER FONT IS SO MESSYYYYYY."
179,Everything I send a photo or when I post something it's very low on quality and everytime my friends send a photo they're quality it's so high but mines so blurred please fix this situation I'm having because I really hate it
180,Please fix this active status problem! I hate this! Usually I turn it off bt still it shows that's I'm online! Ughhh!
181,This is a very good app it helps you out when you need it the Most so jump in to it and find out what you've been missing.
182,"Stupid developer..why you dont even listen to user to get rid of the weird white line at the bottom. It is very annoying, yet it never been fix after so many updates."
183,"Something it's very slow and doesn't opens at all, a lots of glitches which is very irritating. Plz fix it."
184,"When I start watching videos of something, it automatically cuts off. I want a solution"
185,It would've been more great if it contained a mark all button for friend requests and massages 🥺it's really tiring to do it step by step
186,Extremely light and extremely fast app! However work on the swipe tool via messenger to be alittle faster too.
187,"Can't logging in Facebook, they keep saying that something wrong with connection but the wifi and 4G still work fine"
188,I give 1 star because this app glitches many many login problem with all Facebook users now a few days please solved it fast then I give you a possitive feedback
189,"I wish there was no star , I've been trying to log into my account it says sorry something went wrong, mxm this app is irritating sometimes, do they even noticed that I'm a Facebook Comedian 😣"
190,Please bring back the font size adjuster. I can't adjust my font size. I don't want a big size of font.
191,I am very so disappointed of this new update 😒. The right bar section above seems so pointless I can't even find setting options like th. now i need to delet this junk app and use Chrome and FB app. What happen developers 😏
192,"That so called messenger lite is irritating me please ,,i can't get text anymore, when am trying to get messenger lite its loading the whole day... change please"
193,Battery drains & lagging in Samsung Galaxy J2 (2016) model. After uninstall device working fine.
194,I don't want to rate a star also when logging out no option of setting and other there was just option of switching acc.😒😒
195,"It's good app and I like it, and I can't open the up so I went here and check if they updates their so and they updated it! After that I can't open it why?"
196,"Please add an option to customize the shortcuts bar, and to cut/reframe the profile picture."
197,"There's a lot of bugs, pls fix it, i can't message my friends becos there's always appearing ""something went wrong"" thingy ugghh"
198,The app is great but Please I've been trying to log in to my account but Facebook isn't working. Is there something wrong with it?
199,Splendid app I got more enjoyment to this app and some time I can delete but after some time I would download because it too small amount of data use
